quote,writer,tags
"এখনো বিষের পেয়ালা ঠোঁটের সামনে তুলে ধরা হয় নি, তুমি কথা বলো",হুমায়ূন আজাদ,"['ধর্ম', 'সমাজ', 'রাজনীতি']"
"আমাদের প্রায়-প্রতিটি মার্ক্সবাদী তাত্ত্বিকের ভেতরে একটি ক’রে মৌলবাদী বাস করে। তারা পান করাকে পাপ মনে করে, প্রেমকে গুনাহ মনে করে, কিন্তু চারখান বিবাহকে আপত্তিকর মনে করে না",হুমায়ূন আজাদ,"['ধর্ম', 'সমাজ', 'রাজনীতি']"
"মসজিদ ভাঙে ধার্মিকেরা,মন্দির ও ভাঙে ধার্মিকেরা তারপর ও তারা দাবী করে তারা ধার্মিক আর যারা ভাঙাভাঙি তে নেই তারা অধার্মিক বা নাস্তিক",হুমায়ূন আজাদ,"['ধর্ম', 'সমাজ', 'রাজনীতি']"
"একটি স্থাপত্যকর্ম সম্পর্কেই আমার কোনো আপত্তি নেই, তার কোনো সংস্কারও আমি অনুমোদন করি না। স্থাপত্যকর্মটি হচ্ছে নারীদেহ।",হুমায়ূন আজাদ,"['প্রেম', 'সমাজ']"
"আগুনকে যে ভয় পায়, সে আগুনকে ব্যবহার করতে পারে না",রবীন্দ্রনাথ ঠাকুর,['উপদেশ']
"দ্বিতীয়, তৃতীয়, চতুর্থ, পঞ্চম প্রেম বলে কিছু নেই। মানুষ যখন প্রেমে পরে তখন প্রতিটি প্রেমই প্রথম প্রেম।",হুমায়ূন আজাদ,"['প্রেম', 'ভালোবাসা দিবস']"
ভালো মানুষের রাগ থাকে বেশি। যারা মিচকা শয়তান তারা রাগে না। পাছায় লাথি মারলেও লাথি খেয়ে হাসবে।,হুমায়ূন আহমেদ,['সমাজ']
"মানুষ সিংহের প্রশংসা করে, কিন্তু আসলে গাধাকেই পছন্দ করে",হুমায়ূন আজাদ,"['সমাজ', 'রাজনীতি']"
"পুঁজিবাদের আল্লার নাম টাকা, মসজিদের নাম ব্যাংক",হুমায়ূন আজাদ,"['সমাজ', 'রাজনীতি']"
সুন্দর মনের থেকে সুন্দর শরীর অনেক আকর্ষনীয়। কিন্তু ভন্ডরা বলেন উলটো কথা,হুমায়ূন আজাদ,['প্রেম']
হিন্দুরা মূর্তিপূজারী; মুসলমানেরা ভাবমূর্তিপূজারী। মূর্তিপূজা নির্বুদ্ধিতা; আর ভাবমূর্তিপূজা ভয়াবহ।,হুমায়ূন আজাদ,"['ধর্ম', 'রাজনীতি']"
"শামসুর রাহমানকে একটি অভিনেত্রীর সাথে টিভিতে দেখা গেছে। শামসুর রাহমান বোঝেন না কার সঙ্গে পর্দায়, আর কার সঙ্গে শয্যায় যেতে হয়",হুমায়ূন আজাদ,"['সমাজ', 'রাজনীতি']"
আগে কারো সাথে পরিচয় হ’লে জানতে ইচ্ছে হতো সে কী পাশ? এখন কারো সাথে দেখা হ’লে জানতে ইচ্ছে হয় সে কী ফেল?,হুমায়ূন আজাদ,"['সমাজ', 'রাজনীতি']"
শ্রদ্ধা হচ্ছে শক্তিমান কারো সাহায্যে স্বার্থোদ্ধারের বিনিময়ে পরিশোধিত পারিশ্রমিক,হুমায়ূন আজাদ,['সমাজ']
"আজকাল আমার সাথে কেউ একমত হ'লে নিজের সম্বন্ধে গভীর সন্দেহ জাগে মনে হয় আমি সম্ভবত সত্যভ্রষ্ট হয়েছি, বা নিম্নমাঝারি হয়ে গেছি",হুমায়ূন আজাদ,['সমাজ']
‘মিনিষ্টার’ শব্দের মূল অর্থ ভৃত্য। বাঙলাদেশের মন্ত্রীদের দেখে শব্দটির মূল অর্থই মনে পড়ে,হুমায়ূন আজাদ,['রাজনীতি']
"আগে কাননবালারা আসতো পতিতালয় থেকে, এখন আসে বিশ্ববিদ্যালয় থেকে",হুমায়ূন আজাদ,['সমাজ']
জনপ্রিয়তা হচ্ছে নেমে যাওয়ার সিঁড়ি। অনেকেই আজকাল জনপ্রিয়তার পথে নেমে যাচ্ছে,হুমায়ূন আজাদ,['সমাজ']
উন্নতি হচ্ছে ওপরের দিকে পতন। অনেকেরেই আজকাল ওপরের দিকে পতন ঘটছে,হুমায়ূন আজাদ,['সমাজ']
"ব্যর্থরাই প্রকৃত মানুষ, সফলেরা শয়তান",হুমায়ূন আজাদ,['সমাজ']
"আমাদের অঞ্চলে সৌন্দর্য অশ্লীল, অসৌন্দর্য শ্লীল। রুপসীর একটু নগ্নবাহু দেখে ওরা হৈ চৈ করে, কিন্তু পথে পথে ভিখিরিনির উলঙ্গ দেহ দেখে ওরা একটুও বিচলিত হয় না",হুমায়ূন আজাদ,['সমাজ']
পরমাত্মীয়ের মৃত্যুর শোকের মধ্যেও মানুষ কিছুটা সুখ বোধ করে যে সে নিজে বেঁচে আছে,হুমায়ূন আজাদ,['সমাজ']
"মহামতি সলোমনের নাকি তিন শো পত্নী, আর সাত হাজার উপপত্নী ছিলো। আমার মাত্র একটি পত্নী। তবু সলোমনের চরিত্র সম্পর্কে কারো কোনো আপত্তি নেই, কিন্তু আমার চরিত্র নিয়ে সবাই উদ্বিগ্ন",হুমায়ূন আজাদ,['সমাজ']
বাঙালি যখন সত্য কথা বলে তখন বুঝতে হবে পেছনে কোনো অসৎ উদ্দেশ্য আছে,হুমায়ূন আজাদ,['সমাজ']
আধুনিক প্রচার মাধ্যমগুলো অসংখ্য শুয়োরবৎসকে মহামানবরূপে প্রতিষ্ঠিত করেছে,হুমায়ূন আজাদ,"['সমাজ', 'রাজনীতি']"
"শুনি মরিলে পাব বেহেস্তখানা, তা শুনে তো মন মানেনা। বাকির লোভে নগদ পাওনা কে ছাড়ে এই ভূবনে",লালন,"['কাম', 'দর্শন', 'ধর্ম']"
"সবাই তোমাকে কষ্ট দিবে, তোমাকে শুধু এমন একজন কে খুঁজে নিতে হবে যার দেয়া কষ্ট তুমি সহ্য করতে পারবে",হুমায়ূন আহমেদ,"['তুমি', 'প্রেম', 'অনুভব', 'অনুভুতি', 'প্রেমপত্র', 'ভালোবাসা দিবস', 'প্রেমিকা', 'অনুভূতি', 'দর্শন', 'উপদেশ', 'প্রেমিক', 'দুঃখ', 'মায়া', 'ভালোবাসা', 'ভালোবাসি', 'প্রেরণা']"
"অধিকাংশ রূপসীর হাসির শোভা মাংসপেশির কৃতিত্ব, হৃদয়ের কৃতিত্ব নয়",হুমায়ূন আজাদ,"['নারী', 'প্রেম']"
"পাকিস্তানিদের আমি অবিশ্বাস করি, যখন তারা গোলাপ নিয়ে আসে, তখনও",হুমায়ূন আজাদ,"['দেশপ্রেম', 'রাজনীতি']"
আবর্জনাকে রবীন্দ্রনাথ প্রশংসা করলেও আবর্জনাই থাকে,হুমায়ূন আজাদ,['সাহিত্য']
নিজের নিকৃষ্ট কালে চিরশ্রেষ্ঠ ব্যক্তিদের সঙ্গ পাওয়ার জন্য রয়েছে বই; আর সমকালের নিকৃষ্ট ব্যক্তিদের সঙ্গ পাওয়ার জন্যে রয়েছে টেলিভিশন ও সংবাদপত্র,হুমায়ূন আজাদ,['সাহিত্য']
শৃঙ্খলপ্রিয় সিংহের থেকে স্বাধীন গাধা উত্তম,হুমায়ূন আজাদ,['উপদেশ']
"প্রাক্তন বিদ্রোহীদের কবরে যখন স্মৃতিসৌধ মাথা তোলে, নতুন বিদ্রোহীরা তখন কারাগারে ঢোকে, ফাসিঁকাঠে ঝোলে",হুমায়ূন আজাদ,"['সমাজ', 'রাজনীতি']"
"একনায়কেরা এখন গণতন্ত্রের স্তব করে, পুজিঁপতিরা ব্যস্ত থাকে সমাজতন্ত্রের প্রশংসায়",হুমায়ূন আজাদ,"['সমাজতন্ত্র', 'রাজনীতি']"
"পুরস্কার অনেকটা প্রেমের মতো; দু-একবার পাওয়া খুবই দরকার, এর বেশি পাওয়া লাম্পট্য",হুমায়ূন আজাদ,['প্রেম']
বেতন বাঙলাদেশে এক রাষ্ট্রীয় প্রতারণা। এক মাস খাটিয়ে এখানে পাঁচ দিনের পারিশ্রমিক দেয়া হয়,হুমায়ূন আজাদ,['রাজনীতি']
"কবিরা বাঙলায় বস্তিতে থাকে, সিনেমার সুদর্শন গর্দভেরা থাকে শীতাতপ নিয়ন্ত্রিত প্রাসাদে",হুমায়ূন আজাদ,['সমাজ']
"মানুষের ওপর বিশ্বাস হারানো পাপ, তবে বাঙালির ওপর বিশ্বাস রাখা বিপজ্জনক",হুমায়ূন আজাদ,['সমাজ']
"বুদ্ধিজীবীরা এখন বিভক্ত তিন গোত্রে। ভন্ড, ভন্ডতর, ভন্ডতম",হুমায়ূন আজাদ,['রাজনীতি']
"শিক্ষকের জীবনের থেকে চোর, চোরাচালানি, দারোগার জীবন অনেক আকর্ষণীয়। এ সমাজ শিক্ষক চায় না, চোর-চোরাচালানি-দারোগা চায়",হুমায়ূন আজাদ,['সমাজ']
"শয়তানের প্রার্থনায় বৃষ্টি নামে না, ঝড় আসে; তাতে অসংখ্য সৎ মানুষের মৃত্যু ঘটে",হুমায়ূন আজাদ,"['ধর্ম', 'রাজনীতি']"
"যে বুদ্ধিজীবী নিজের সময় ও সমাজ নিয়ে সন্তুষ্ট, সে গৃহপালিত পশু",হুমায়ূন আজাদ,['সমাজ']
"পা, বাঙলাদেশে, মাথার থেকে অনেক বেশি গুরুত্বপূর্ণ। পদোন্নতির জন্যে এখানে সবাই ব্যগ্র। কিন্তু মাথার যে অবনতি ঘটছে, তাতে কারো কোনো উদ্বেগ নেই",হুমায়ূন আজাদ,"['রাজনীতি', 'উপদেশ']"
এখানকার একাডেমিগুলো সব ক্লান্ত গর্দভ; মুলো খাওয়া ছাড়া ওগুলোর পক্ষে আর কিছু অসম্ভব,হুমায়ূন আজাদ,"['মিডিয়া', 'রাজনীতি']"
"জন্মান্তরবাদ ভারতীয় উপমহাদেশের অবধারিত দর্শন। এ অঞ্চলে এক জন্মে পরীক্ষা দিতে হয়, আরেক জন্মে ফল বেরোয়, দু-জন্ম বেকার থাকতে হয়, এবং ভাগ্য প্রসন্ন হ’লে কোন এক জন্মে চাকুরি মিলতেও পারে",হুমায়ূন আজাদ,"['ধর্ম', 'উপদেশ']"
"রবীন্দ্রনাথের নোবেল পুরস্কার পাওয়ার দরকার ছিলো না, কিন্তু দরকার ছিলো বাঙলা সাহিত্যের। পুরস্কার না পেলে হিন্দুরা বুঝতো না যে রবীন্দ্রনাথ বড়ো কবি; আর মুসলমানেরা রহিম, করিমকে দাবি করতো বাঙলার শ্রেষ্ঠ কবি হিশেবে",হুমায়ূন আজাদ,"['সাহিত্য', 'রাজনীতি']"
"বাঙলাদেশে কয়েকটি নতুন শাস্ত্রের উদ্ভব ঘটেছে; এগুলো হচ্ছে স্তুতিবিজ্ঞান, স্তব সাহিত্য, সুবিধা দর্শন ও নমস্কারতত্ত্ব",হুমায়ূন আজাদ,"['ধর্ম', 'রাজনীতি']"
"এখানে অসতেরা জনপ্রিয়, সৎ মানুষেরা আক্রান্ত",হুমায়ূন আজাদ,"['সমাজ', 'উপদেশ']"
"টেলিভিশন, নিকৃষ্ট জিনিশের একনম্বর পৃষ্ঠপোষক, হিরোইন প্যাথেডিনের থেকেও মারাত্মক। মাদক গোপনে নষ্ট করে কিছু মানুষকে, টেলিভিশন প্রকাশ্যে নষ্ট করে কোটি কোটি মানুষকে",হুমায়ূন আজাদ,"['মিডিয়া', 'সমাজ', 'রাজনীতি']"
পৌরানিক পুরুষেরা সামান্য অভিজ্ঞতা ভিত্তি ক‘রে অসামান্য সব সিদ্ধান্ত নিতেন। যযাতি পুত্রের কাছে থেকে যৌবন ধার ক’রে মাত্র এক সহস্র বছর সম্ভোগের পর সিদ্ধান্তে পৌছেন যে সম্ভোগে কখনো তৃপ্তি আসে না! এতো বড়ো একটি সিদ্ধান্তের জন্যে সহস্র বছর খুবই কম সময় : আজকাল কেউ এতো কম অভিজ্ঞতায় এতো বড়ো একটি সিদ্ধান্ত নেয়ার সাহস করবে না,হুমায়ূন আজাদ,"['ধর্ম', 'উপদেশ']"
"অভিনেতারা সব সময়ই অভিনেতা; তারা যখন বিপ্লব করে তখন তারা বিপ্লবের অভিনয় করে। এটা সবাই বোঝে, শুধু তারা বোঝে না",হুমায়ূন আজাদ,"['মিডিয়া', 'সমাজতন্ত্র']"
বাঙলাদেশের প্রধান মূর্খদের চেনার সহজ উপায় টেলিভিশনে কোনো আলোচনা-অনুষ্ঠান দেখা। ওই মূর্খমন্ডলিতে উপস্থাপকটি হচ্ছেন মূর্খশিরোমণি,হুমায়ূন আজাদ,['মিডিয়া']
পৃথিবী জুড়ে প্রতিটি নরনারী এখন মনে করে তাদের জীবন ব্যর্থ; কেননা তারা অভিনেতা বা অভিনেত্রী হতে পারেনি,হুমায়ূন আজাদ,"['নারী', 'সমাজ']"
মৌলিকতা হচ্ছে মঞ্চ থেকে দূরে অবস্থান,হুমায়ূন আজাদ,"['সাহিত্য', 'সমাজ', 'রাজনীতি']"
"এরশাদের প্রধান অপরাধ পরিবেশদূষন: অন্যান্য সরকারগুলো পুরুষদের দূষিত করেছে, এরশাদ দূষিত করেছে নারীদেরও",হুমায়ূন আজাদ,"['নারী', 'রাজনীতি']"
"বাঙালি একশো ভাগ সৎ হবে, এমন আশা করা অন্যায়। পঞ্চাশ ভাগ সৎ হ’লেই বাঙালিকে পুরস্কার দেয়া উচিত",হুমায়ূন আজাদ,"['সমাজ', 'উপদেশ']"
"একজন চাষী বা নদীর মাঝি সাংস্কৃতিকভাবে যতোটা মূল্যবান, সারা সচিবালয় ও মন্ত্রীপরিষদও ততোটা মূল্যবান নয়",হুমায়ূন আজাদ,['রাজনীতি']
মানুষ ও কবিতা অবিচ্ছেদ্য। মানুষ থাকলে বুঝতে হবে কবিতা আছে : কবিতা থাকলে বুঝতে হবে মানুষ আছে।,হুমায়ূন আজাদ,"['কবিতা', 'সাহিত্য']"
"বাঙালি আন্দোলন করে, সাধারণত ব্যর্থ হয়, কখনো কখনো সফল হয়; এবং সফল হওয়ার পর মনে থাকে না কেনো তারা আন্দোলন করেছিলো",হুমায়ূন আজাদ,['রাজনীতি']
"এখন পিতামাতারা গৌরব বোধ করেন যে তাঁদের পুত্রটি গুন্ডা। বাসায় একটি নিজস্ব গুন্ডা থাকায় প্রতিবেশীরা তাঁদের সালাম দেয়, মুদিদোকানদার খুশি হয়ে বাকি দেয়, বাসার মেয়েরা নির্ভয়ে একলা পথে বেরোতে পারে, এবং বাসায় একটি মন্ত্রী পাওয়ার সম্ভাবনা থাকে",হুমায়ূন আজাদ,"['সমাজ', 'উপদেশ']"
"এদেশের মুসলমান এক সময় মুসলমান বাঙালি, তারপর বাঙালি মুসলামান, তারপর বাঙালি হয়েছিলো; এখন আবার তারা বাঙালি থেকে বাঙালি মুসলমান, বাঙালি মুসলমান থেকে মুসলমান বাঙালি, এবং মুসলমান বাঙালি থেকে মুসলমান হচ্ছে। পৌত্রের ঔরষে জন্ম নিচ্ছে পিতামহ",হুমায়ূন আজাদ,"['ধর্ম', 'সমাজ', 'উপদেশ']"
"নিন্দুকেরা পুরোপুরি অসৎ হ’তে পারেন না, কিছুটা সততা তাঁদের পেশার জন্যে অপরিহার্য; কিন্তু প্রশংসাকারীদের পেশার জন্য মিথ্যাচারই যথেষ্ট",হুমায়ূন আজাদ,"['অসৎ', 'সমাজ', 'সততা', 'উপদেশ']"
"প্রতিটি সার্থক প্রেমের কবিতা বলতে বোঝায় যে কবি প্রেমিকাকে পায় নি, প্রতিটি ব্যর্থ প্রেমের কবিতা বোঝায় যে কবি প্রেমিকাকে বিয়ে করেছে",হুমায়ূন আজাদ,['প্রেম']
তৃতীয় বিশ্বের নেতা হওয়ার জন্যে দুটি জিনিশ দরকার : বন্দুক ও কবর,হুমায়ূন আজাদ,"['সমাজ', 'রাজনীতি']"
প্রতিটি বিজ্ঞাপনে পণ্যটির থেকে পণ্যাটি অনেক লোভনীয়; তাই ব্যর্থ হচ্ছে বিজ্ঞাপনগুলো। দর্শকেরা পণ্যের থেকে পণ্যাটিকেই কিনতে ও ব্যবহার করতে অধিক আগ্রহ বোধ করে,হুমায়ূন আজাদ,"['মিডিয়া', 'পুজিঁবাদ']"
"কোন দেশের লাঙলের রূপ দেখেই বোঝা যায় ওই দেশের মেয়েরা কেমন নাচে, কবিরা কেমন কবিতা লেখেন, বিজ্ঞানীরা কি আবিষ্কার করেন, আর রাজনীতিকেরা কতোটা চুরি করে",হুমায়ূন আজাদ,"['সমাজ', 'রাজনীতি']"
"যারা ধর্মের বৈজ্ঞানিক ব্যাখ্যা দেয়, তারা ধার্মিকও নয়, বিজ্ঞানীও নয়। শুরুতেই স্বর্গ থেকে যাকে বিতারিত করা হয়েছিলো, তারা তার বংশধর",হুমায়ূন আজাদ,"['বিজ্ঞান', 'ধর্ম']"
"যতোদিন মানুষ অসৎ থাকে, ততোদিন তার কোনো শত্রু থাকে না; কিন্তু যেই সে সৎ হয়ে উঠে, তার শত্রুর অভাব থাকে না",হুমায়ূন আজাদ,"['সুখ', 'সমাজ', 'উপদেশ']"
"এদেশে সবাই শিক্ষানুরাগী ও সমাজসেবক : দারোগার শোকসংবাদেও লেখা হয়, ‘তিনি শিক্ষানুরাগী ও সমাজসেবক ছিলেন’",হুমায়ূন আজাদ,"['শিক্ষা', 'সমাজ']"
শিল্পকলা হচ্ছে নিরর্থক জীবনকে অর্থপূর্ণ করার ব্যর্থ প্রয়াস,হুমায়ূন আজাদ,['শিল্প']
"কিছু বিশেষন ও বিশেষ্য পরস্পরসম্পর্কিত; বিশেষ্যটি এলে বিশেষন আসে, বিশেষন এলে বিশেষ্য আসে। তারপর একসময় একটি ব্যবহার করলেই অন্যটি বোঝায়, দুটি একসাথে ব্যবহার করতে হয় না। যেমন: ভন্ড বললেই পীর আসে, আবার পীর বলতেই ভন্ড আসে। এখন আর ‘ভন্ড পীর’ বলতে হয় না; ‘পীর’ বললেই ‘ভন্ড পীর’ বোঝায়",হুমায়ূন আজাদ,"['সমাজ', 'রাজনীতি']"
ভক্ত শব্দের অর্থ খাদ্য। প্রতিটি ভক্ত তার গুরুর খাদ্য। তাই ভক্তরা দিনদিন জীর্ণ থেকে জীর্ণতর হয়ে আবর্জনায় পরিণত হয়,হুমায়ূন আজাদ,['ধর্ম']
