quote,writer,tags
"আমি এটি এজন্য উল্লেখ করিনি যে, বিশ্ব চরাচর কখন ধ্বংস হবে তার সময় আমি সবাইকে জানাতে চাই; বরং এজন্য যে, কল্পনার রাজ্যে বসবাসকারী ব্যক্তিরা বিশ্বের ধ্বংস সম্বন্ধে যা বলছেন তার সবগুলোকে একটি সীমার মধ্যে বেঁধে দেয়া। এবং এটি করার মাধ্যমে আমি পবিত্র ভবিষ্যদ্বাণীসমূহের যেটি ব্যর্থ প্রমাণিত হবে তাকে সাথে সাথে বিফল হিসেবে চিহ্নিত করার উপায় নির্ধারণ করলাম।",আইজাক নিউটন,['দর্শন']
"আমি জানিনা বিশ্বের কাছে আমি কিভাবে উপস্থাপিত হয়েছি, কিন্তু আমার কাছে আমার নিজেকে মনে হয় এক ছোট বালক যে কেবল সমুদ্র উপত্যকায় খেলা করছে এবং একটি ক্ষুদ্র নুড়ি বা ক্ষুদ্রতর এবং খুব সাধারণ পাথর সন্ধান করছে, অথচ সত্যের মহাসমুদ্র তার সম্মুখে পড়ে রয়েছে যা অনাবিষ্কৃতই রয়ে গেল।",আইজাক নিউটন,['দর্শন']
"যে সমাজে শিক্ষিত, স্বনির্ভর, সচেতন মেয়ের সংখ্যা বেশি, সেই সমাজে বিচ্ছেদের সংখ্যাটা বেশি, বিয়ের সংখ্যাটা কম।",তসলিমা নাসরিন,"['নারী', 'সমাজ', 'বিবাহ-বিচ্ছেদ']"
আমার ভিতর বাহিরে অন্তরে অন্তরেআছো তুমি হৃদয় জুড়ে,রুদ্র মুহাম্মদ শহীদুল্লাহ,"['প্রেম', 'ভালোবাসা']"
"ভালো আছি, ভালো থেকোআকাশের ঠিকানায় চিঠি লিখ",রুদ্র মুহাম্মদ শহীদুল্লাহ,"['প্রেম', 'ভালোবাসা']"
"যারা বলে অসম্ভব, অসম্ভব তাদের দুয়ারেই বেশি হানা দেয়",জন সার্কল,['আত্নবিশ্বাস']
"জন্মদিনের উৎসব করাটা বোকামি। জীবন থেকে একটা বছর ঝরে গেল, সে জন্যে অনুতাপ করাই উচিত।",নরম্যান বি.হল,"['মন', 'জীবন']"
"আমাদের মধ্যে সবাই সব বড় কাজ গুলো করতে পারবে তানা, কিন্তু আমরা অনেক ছোট কাজ গুলো করতে পারি আমাদের অনেক বেশী ভালবাসা দিয়ে।",মাদার তেরেসা,"['প্রেম', 'ভালোবাসা']"
চিকিৎসকেরা যে ভুল করেন তা হল তারা মনের চিকিৎসা না করে শরীর সারাতে চান। যদিও মন আর শরীর অবিচ্ছেদ্য তাই আলাদা করে চিকিৎসা করা উচিত নয়।,প্লেটো,"['মন', 'জীবন']"
"যে অল্প লইয়া সুখী সেই ভাগ্যবান, আর বিত্তশালী হইয়াও যে অসুখী সে দুর্ভাগাই বটে।",ডেমোক্রিটাস,['লোভ']
পৃথিবীতে বা সমুদ্রে যত হিংস্র প্রাণী আছে সবছেয়ে বৃহত্তম প্রাণী হল মেয়েরা।,মেনানডির,['নারী']
"পৃথিবীতে বালিকার প্রথম প্রেমেরমত সর্বগ্রাসী প্রেম আর কিছুই নাই। প্রথমযৌবনে বালিকা যাকে ভালোবাসে তাহার মত সৌভাগ্যবানও আর কেহই নাই। যদিও সে প্রেম অধিকাংশ সময় অপ্রকাশিত থেকে যায়, কিন্তু সে প্রেমের আগুন সব বালিকাকে সারাজীবন পোড়ায়।",রবীন্দ্রনাথ ঠাকুর,"['প্রেম', 'ভালোবাসা']"
"ছেলে এবং মেয়ে বন্ধু হতে পারে, কিন্তু তারা অবশ্যই একে অপরের প্রেমে পড়বে। হয়ত খুবই অল্প সময়ের জন্য, অথবা ভুল সময়ে। কিংবা খুবই দেরিতে, আর না হয় সব সময়ের জন্য। তবে প্রেমে তারা পড়বেই।",হুমায়ূন আহমেদ,"['প্রেম', 'ভালোবাসা']"
"যে মনের দিক থেকে বৃদ্ধ নয়, বার্ধক্য তার জীবনে আসে না",ফিলিপ ম্যাসিঞ্জার,"['মন', 'জীবন']"
ছেলেরা ভালোবাসার অভিনয় করতে করতে যে কখন সত্যি সত্যি ভালবেসে ফেলে তারা তা নিজেও জানেনা। মেয়েরা সত্যিকার ভালবাসতে বাসতে যে কখন অভিনয় শুরু করে তারা তা নিজেও জানেনা।,সমরেশ মজুমদার,"['প্রেম', 'ভালোবাসা']"
"পৃথিবীতে দু-ধরনের মানুষ আছে। এদের একদল বেঁচে থাকার জন্য খায়; আর একদল আছে যারা খাওয়ার জন্য বেঁচে থাকে। পৃথিবীর যা-কিছু মহৎ কাজ, তা প্রথম দলের লোকেরাই করে থাকে।",বি. সি. রায়,"['পান', 'খাওয়া']"
প্রাচুর্যের মধ্যে থাকা কালে দুঃখীদের মধ্যে উপদেশ দেয়া খুব ই সহজ,এস.কাইলাস,['উপদেশ']
বিয়ে হচ্ছে বুদ্ধির কাছে কল্পনার জয় আর দ্বিতীয় বিয়ে হচ্ছে অভিজ্ঞতার কাছে আশার জয়,স্যামুয়েল জনসন,['বিবাহ']
ভালোবাসা হচ্ছে একধরনের মায়া যেখানে পুরুষ এক নারীকে অন্য নারী থেকে আলাদা করে দেখে আর নারী এক পুরুষকে অন্য পুরুষ থেকে আলাদা করে দেখে,লুইস ম্যাকেন,"['প্রেম', 'ভালোবাসা']"
ভালোবাসা হচ্ছে একটা আদর্শ ব্যাপার আর বিয়ে হচ্ছে বাস্তব। আদর্শ ও বাস্তবতার দ্বন্দ্ব তাই কখনো নিষ্পত্তি হবে না।,গেটো,"['প্রেম', 'ভালোবাসা']"
ভালোবাসায় পতনের জন্য কোনোভাবেই আমরা মহাকর্ষ-অভিকর্ষকে দায়ী করতে পারি না,অ্যালবার্ট আইনস্টাইন,"['প্রেম', 'ভালোবাসা']"
"যত বেশি করে আহার খাবে, তত বেশি ঔষধের প্রয়োজন হবে",ফ্রান্সিস বেকন,"['আহার', 'পান', 'খাওয়া']"
"প্রেমের বেলায় ঘন্টার অনুপস্থিতিকে মাস, দিনের অনুপস্থিতিকে বছর ও অল্প সময়ের অনুপস্থিতিকে অনন্তকাল সময়ের অনুপস্থিতি বলে মনে হয়",প্রবাদ,"['প্রেম', 'ভালোবাসা']"
যদি সর্বোচ্চ আসন পেতে চাও তাহলে সর্বনিম্ন স্থান থেকে আরম্ভ কর,সাইরাস চিং,['সাফল্য']
"একজন নারী হয় ভালবাসে অথবা ঘৃণা করে, এছাড়া জানে না তৃতীয় কোন পন্থা",পিউবিলিয়াস সিরাস,"['প্রেম', 'ভালোবাসা']"
সুন্দরীদের বোকা বোকা কথাও স্বর্গীয় বাণীর সমতুল্য,কৃষণ চন্দর,"['প্রেম', 'ভালোবাসা']"
সৌন্দর্য যে ক্ষনস্থায়ী ফুলকে দেখেই তা উপলদ্ধি করতে হবে,হেলেন হান্ট,['সৌন্দর্য']
নিজেকে কখনো অপরের চেয়ে ছোট মনে করো না,জন কিপলিং,['আত্নবিশ্বাস']
"যে নিজেকে অক্ষম ভাবে, তাকে কেউ সাহায্য করতে পারে না",জন এন্ডারসন,['অক্ষম']
"যে তোমার দোষ ধরে বন্ধু সেই জন, সম্মুখে তারিফ করে দুষমন সে জন",হযরত ওমর ফারুক (রাঃ),['বন্ধু']
"সংসারে কারো ওপর ভরসা করো না, নিজের হাত এবং পায়ের ওপর ভরসা করতে শেখো",উইলিয়াম শেক্সপিয়র,"['মন', 'জীবন']"
"শত্রুকে যদি একবার ভয় কর তবে বন্ধুকে অন্তত দশবার ভয় করিও, কারণ বন্ধু যদি কোনোসময় শত্রু হয় তখন তার কবল হইতে মুক্তি পাওয়া সম্ভব হইবে না",ইবনুল ফুরাত,"['শত্রু', 'বন্ধু']"
"তোমার যা ভাললাগে তাই জগৎকে দান কর, বিনিময়ে তুমিও অনেক ভালো জিনিস লাভ করবে",হযরত আলী (রাঃ),['দান']
কৃতজ্ঞ কুকুর অকৃতজ্ঞ মানুষের চেয়ে শ্রেয়,শেখ সাদি,"['কৃতজ্ঞ', 'মানুষ', 'কুকুর', 'অকৃতজ্ঞ']"
"একমাত্র প্রেমেই বিয়েকে পবিত্র করতে পারে। আর একমাত্র অকৃত্রিম বিয়ে হচ্ছে সেটাই, যেটা প্রেমের দ্বারা পবিত্রকৃত।",লিও তলস্তয়,"['প্রেম', 'ভালোবাসা', 'বিয়ে']"
"ভালবাসতে শেখ, ভালবাসা দিতে শেখ। তাহলে তোমার জীবনে ভালবাসার অভার হবেনা।",টমাস কুলার,"['প্রেম', 'ভালোবাসা']"
যাকে ভালবাস তাকে চোখের আড়াল করোনা,বঙ্কিমচন্দ্র চট্টোপাধ্যায়,"['প্রেম', 'ভালোবাসা']"
একমাত্র ভালবাসা সারাতে পারে সব রোগ,গতিয়ে,"['প্রেম', 'ভালোবাসা']"
"পাখিরা বাসা বাধে লতা পাতা দিয়ে,আর মানুষ বাধে ভালবাসা দিয়ে।",মুঃ ইসহাক কোরেশী,"['প্রেম', 'ভালোবাসা']"
"মানুষের জীবন হলো একটি ফুল, আর ভালবাসা হলো মধুস্বরুপ",ভিক্টর হোগো,"['প্রেম', 'ভালোবাসা']"
ভালবাসা এমন একটি প্লাটফরম যেখানে সব মানুষ দাড়াতে পারে,টমাস মিল্টন,"['প্রেম', 'ভালোবাসা']"
ভালবাসা দিয়ে মরুভুমিতে ফুল ফোটানো যায়,ডেভিসবস,"['প্রেম', 'ভালোবাসা']"
ভালবাসা হৃদয়ের দরজা মুহুর্তেই খুলে দেয়,টমাস মিল্টন,"['প্রেম', 'ভালোবাসা']"
ভালবাসা হচ্ছে জীবনের বন্ধু,জেমস হাওয়েল,"['প্রেম', 'ভালোবাসা']"
ভালবাসার নদীতে জোয়ার ভাটা আছে,জন হে,"['প্রেম', 'ভালোবাসা']"
গভীর ভালবাসার কোন ছিদ্রপথ নেই,জর্জ হেইড,"['প্রেম', 'ভালোবাসা']"
যে ভালবাসে কিন্তু প্রকাশ করে কম সে ভালবাসার ক্ষেত্রে প্রকৃত,জর্জ ডেবিটসন,"['প্রেম', 'ভালোবাসা']"
অন্ধভাবে কাউকে ভালবাসলে তার ফল শুভ হতে পারেনা,কার্লাইল,"['প্রেম', 'ভালোবাসা']"
ভালবাসা দিয়েই কেবল ভালবাসার ঋণ পরিশোধ করা যায়,আলেকজেন্ডার ব্রাকেন,"['প্রেম', 'ভালোবাসা']"
ভালবাসার কোন অর্থ বা পরিমাণ নেই,কাজী নজরুল ইসলাম,"['প্রেম', 'ভালোবাসা']"
"মেয়েদের চোঁখে দুই রকমের অশ্রু থাকে,একটি দুঃখের অপরটি ছলনার",পিথাগোরাস,"['নারী', 'দুঃখ', 'ছলনা', 'অশ্রু']"
মোরা একটি ফুলকে বাঁচাবো বলে যুদ্ধ করি,গোবিন্দ হালদার,"['সংগীত', 'দেশপ্রেম']"
"তোমার আমার ঠিকানা, পদ্মা মেঘনা যমুনা",গোবিন্দ হালদার,"['সংগীত', 'দেশপ্রেম']"
এক সাগর রক্তের বিনিময়ে বাংলার স্বাধীনতা আনলে যারা আমরা তোমাদের ভুলব না,গোবিন্দ হালদার,"['সংগীত', 'দেশপ্রেম']"
"পূর্ব দিগন্তে সূর্য উঠেছেরক্ত লাল, রক্ত লাল, রক্ত লাল",গোবিন্দ হালদার,"['সংগীত', 'দেশপ্রেম']"
মৌলবাদ হচ্ছে আল্লার কিংবা ভগবানের নামে শয়তানবাদ,সংগৃহীত,"['মৌলবাদ', 'ধর্ম']"
"হয়ে যাওয়া আর হবু, এক হয় না কভু",প্রবাদ,['কার্য']
"সবকিছুর শুরু, মধ্য এবং অন্তই হচ্ছে প্রেম।",নফডেয়ার,"['প্রেম', 'ভালোবাসা']"
প্রেম হল ধীর প্রশান্ত ও চিরন্তন,কাজী নজরুল ইসলাম,"['তুমি', 'প্রেম', 'অনুভব', 'অনুভুতি', 'প্রেমপত্র', 'ভালোবাসা দিবস', 'প্রেমিকা', 'অনুভূতি', 'প্রেমিক', 'মায়া', 'ভালোবাসা', 'ভালোবাসি', 'প্রেরণা']"
প্রেম হল মানসিক ব্যাধি,প্লেটো,"['প্রেম', 'ভালোবাসা']"
বারবার একই ব্যাক্তির প্রেমে পড়া সার্থক প্রেমের নিদর্শন,ব্রোটন,"['প্রেম', 'ভালোবাসা']"
"ছোট ছোট মুখ জানে না ধরার দুখ, হেসে আসে তোমাদের দ্বারে। নবীণ নয়ন তুলি কৌতুকেতে দুলি দুলি চেয়ে চেয়ে দেখে চারিধারে।",রবীন্দ্রনাথ ঠাকুর,"['মন', 'জীবন']"
যৌবন করে না ক্ষমা প্রতি অঙ্গে অঙ্গীকার করে মনোরমা বিশ্বের শরীরে। অপরুপ উপহারে কখন সাজায় বোঝাও না যায়।,বুদ্ধদেব বসু,"['শরীর', 'জীবন', 'আদেশ', 'আদর্শ', 'মন', 'উপদেশ']"
"মনের অনেক দরজা আছে, সেখান দিয়ে অসংখ্যজন প্রবেশ করে এবং বের হয়ে যায় তাই সবাইকে মনে রাখা সম্ভব হয় না।",টমাস কেস্পিস,"['মন', 'জীবন']"
আত্না কলুষিত হতে শুরু করলেই মন আকারে সুরু হতে থাকে,রুশো,"['মন', 'জীবন']"
"একটা মন আর একটা মনকে খুজিতেছে নিজের ভাবনার ভার নামাইয়া দিবার জন্য, নিজের মনের ভাবকে অণ্যের মনে ভাবিত করিবার জন্য।",রবীন্দ্রনাথ ঠাকুর,"['মন', 'জীবন']"
মন যখন ঘুরে বেড়ায় কান আর চোখ তখন অকেজো হয়ে দাড়ায়,প্রবাদ,"['মন', 'জীবন']"
"একটা সুন্দর মন অন্ধকারে আলোর মতো, যার মাধ্যমে কলুষতার মাঝেও নিজের অস্থিত্বকে মর্যাদাসম্পন্ন রাখা যায়",দানিয়েল,"['মন', 'জীবন']"
"মানুষের জীবনে বিশ বছর পর্যন্ত ইচ্ছার রাজত্ব চলে, তিরিশ বছর পর্যন্ত চলে বুদ্ধির বাজত্ব এবং চল্লিশ বছর বয়সে বিচার-বিবেচনার রাজত্ব।",ফ্রাংকলিন,"['মন', 'জীবন']"
খাও পান করো আর ভালবাসো। কারণ জীবন ক্ষণস্থায়ী।,বায়রন,"['মন', 'জীবন']"
"জীবনের নিগূঢ় সত্যটি হচেছ, কখনো এমন কোনো আবেগকে প্রশ্রয় না দেওয়া যা অশোভন।",অস্কার ওয়াইল্ড,"['মন', 'জীবন']"
জীবন যতক্ষণ আছে বিপদ ততক্ষণ থাকবেই,ইমারসন,"['মন', 'জীবন']"
এই তো জীবন পাওয়া আর হারানোর - তবু হাত বাড়ানোর ভুল আশা নিরাশার কাটার দহণ,দীনেশ গঙ্গোপাধ্যায়,"['মন', 'জীবন']"
শান্ত এবং পরিচ্ছন্ন জীবন স্বাস্থ্যরক্ষার উৎকৃষ্ট খাদ্যের চেয়ে গুরুত্বপূর্ণ ভুমিকা পালন করে।,উইলিয়াম ল্যাং ল্যান্ড,"['মন', 'জীবন']"
জীবন মানেই সাফল্য এবং সাফল্য মানেই দু্র্ভোগ।,ভ্যানলুন,"['মন', 'জীবন']"
সংগ্রামী জীবন দীর্ঘ এবং আনন্দপুর্ন জীবন প্রায়শই ক্ষনিকের হয়,জ্যাকব এ. রিস,"['মন', 'জীবন']"
জীবন ছোট বলেই মহান,ডিজরেইলি,"['মন', 'জীবন']"
"একটি মহৎঅন্তর, পৃতিবীর সমস্ত মাথার চেয়ে ভালো",বুলার লিটন,"['মন', 'জীবন']"
দুর্বল দেহ মনকে দুর্বল করে দেয়,রুশো,"['মন', 'জীবন']"
সুন্দর থাকা একটি সুন্দর রাজ্যে বসবাস করার আনন্দের মতো,জন ওয়েসলে,"['মন', 'জীবন']"
হোটেলের সেরা ব্যাপার হলো এটি নিজের ঘর নয়,জর্জ বার্নার্ড শ,"['মন', 'জীবন']"
"সম্ভবই পলিমাটির দেশ বলিয়াই আমাদের জীবনের কোন ভাগে কোন বুনিয়াদ পাকা হইতে পারে না। মাটির উপরেও যেমন কোন চিহ্ন থাকে না, মনের ভিতরে তেমন স্মৃতি পুষিয়া রাখি না।",মোহিতলাল মজুমদার,"['মন', 'জীবন']"
"সকল সাধুই মজজা দেখতে পারেন, কিন্তু খুব কম সাধুই আছেন যারা চালাতে সক্ষম।",মার্ক টোয়েইন,"['মন', 'জীবন']"
"বলির পাঠারা সব সময়েই ধারন করেছে মানুষের অত্যাচার, দুর্নীতি আর কষ্ট করবার হিংস্র প্রবণতাকে মুক্তি দেয়ার রহস্যময় ক্ষমতা",মারিয়াক,"['সুখ', 'দুঃখ']"
জীবনকে যেমন মৃত্যুকেও তেমনি স্বাভবিক বলে মেনে নিতে হবে,শহীদুল্লাহ্ কায়সার,"['মন', 'জীবন']"
"জীবন তৃপ্তি দেয় যতটুকু, অতৃপ্তি দেয় তার চেয়ে বেশি",ক্রিস্টিনা রসের্ট,"['মন', 'জীবন']"
মন হল সবচাইতে বড় তর্কশাস্ত্রবিদ,ফিলিপস,"['মন', 'জীবন']"
কল্পনাশক্তিই হল আত্নার দৃস্টিশক্তি,সৈয়দ ইসমাইল হোসেন সিরাজী,"['মন', 'জীবন']"
উৎকৃষ্ট বীজ থেকেই উত্তম বৃক্ষ জন্ম নেয়,জন গে,"['মন', 'জীবন']"
শিশুর প্রকাশের মাধ্যম অনেক। তর ভাষার প্রয়োজন হয় না।,চালর্স ডিকেন্স,['শিশুর মন']
"শিশুরা সৃস্টিকর্তার দূতঃ দিনের পর দিন যারা প্রেম, আশা আর শক্তি সর্স্পকে প্রচারের জন্য প্রেরিত হয়",জেসম্ রাছেল লোভেল,['শিশুর মন']
"শিশুর ব্যক্তিত্বের প্রতি বিশ্বাসী হোন, তার উপর মাত্রাতিরিক্ত অভিভাবকত্ব করবেন না, শিশূর রাজ্যে অনাধিকার প্রবেশ ও তার মানসিকতার পক্ষে শুভ নয়।",ইমারসন,['শিশুর মন']
বেশি যারা ভাবে তারা জীবনকে উপভোগ করতে পারে না,বুদ্ধদেব গুহ,"['মন', 'জীবন']"
