quote,writer,tags
"দেখেছি সবুজ পাতা অঘ্রানের অন্ধকারে হয়েছে হলুদ হিজলের জানালায় আলো আর বুলবুলি করিয়াছে খেলা, ইঁদুর শীতের রাতে রেশমের মতো রোমে মাখিয়াছে খুদ, চালের ধূসর গন্ধে তরঙ্গেরা রূপ হয়ে ঝরেছে দু — বেলা নির্জন মাছের চোখে — পুকুরের পাড়ে হাঁস সন্ধ্যার আঁধারে পেয়েছে ঘুমের ঘ্রাণ — মেয়েলি হাতের স্পর্শ লয়ে গেছে তারে",জীবনানন্দ দাশ,"['দেশপ্রেম', 'সন্ধ্যা', 'প্রত্যাশা', 'প্রকৃতিপ্রেম', 'দেশ', 'অনুরাগ', 'প্রেমপত্র', 'ভালোবাসা দিবস', 'প্রেমিকা', 'প্রেমিক', 'প্রকৃতি', 'প্রেম', 'ভালোবাসা', 'ভালোবাসি', 'প্রেরণা']"
"মিনারের মতো মেঘ সোনালি চিলেরে তার জানালায় ডাকে, বেতের লতার নিচে চড়য়ের ডিম যেন শক্ত হয়ে আছে, নমর জলের গন্ধ দিয়ে নদী বারবার তীরটিরে মাখে, খড়ের চালের ছায়া গাঢ় রাতে জোছনার উঠানে পড়িয়াছে; বাতাসে ঝিঁঝির গন্ধ — বৈশাখের প্রান্তরের সবুজ বাতাসে; নীলাভ নোনার বুকে ঘর রস গাঢ় আকাঙক্ষায় নেমে আসে",জীবনানন্দ দাশ,"['দেশপ্রেম', 'সন্ধ্যা', 'প্রভেদ', 'প্রকৃতিপ্রেম', 'ভাষা', 'দেশ', 'প্রেমপত্র', 'ভালোবাসা দিবস', 'প্রেমিকা', 'দেশবাসী', 'প্রত্যাশা', 'প্রেমিক', 'প্রকৃতি', 'প্রেম', 'ভালোবাসা', 'ভালোবাসি', 'প্রেরণা']"
"আমরা দেখেছি যারা নিবিড় বটের নিচে লাল লাল ফল পড়ে আছে; নির্জন মাঠের ভিড় মুখ দেখে নদীর ভিতরে; যত নীল আকাশেরা রয়ে গেছে খুঁজে ফেরে আরো নীল আকাশের তল; পথে পথে দেখিয়াছি মৃদু চোখ ছায়া ফেলে পৃথিবীর পরে আমরা দেখেছি যারা শুপুরির সারি বেয়ে সন্ধ্যা আসে রোজ, প্রতিদিন ভোর আসে ধানের গুচ্ছের মতো সবুজ সহজ",জীবনানন্দ দাশ,"['দেশপ্রেম', 'সন্ধ্যা', 'প্রভেদ', 'প্রকৃতিপ্রেম', 'ভাষা', 'দেশ', 'প্রেমপত্র', 'ভালোবাসা দিবস', 'প্রেমিকা', 'দেশবাসী', 'প্রত্যাশা', 'প্রেমিক', 'প্রকৃতি', 'প্রেম', 'ভালোবাসা', 'ভালোবাসি', 'প্রেরণা']"
আমরা বুঝেছি যারা বহু দিন মাস ঋতু শেষ হলে পর পৃথিবীর সেই কন্যা কাছে এসে অন্ধকারে নদীদের কথা কয়ে গেছে আমরা বুঝেছি যারা পথ ঘাট মাঠের ভিতর আরো এক আলো আছে: দেহে তার বিকাল বেলার ধুসরতা: চোখের — দেখার হাত ছেড়ে দিয়ে সেই আলো হয়ে আছে স্থির; পৃথিবীর কঙ্কাবতী ভেসে গিয়ে সেইখানে পায় ম্লান ধূপের শরীর,জীবনানন্দ দাশ,"['দেশপ্রেম', 'সন্ধ্যা', 'প্রকৃতিপ্রেম', 'প্রত্যাশা', 'ভাষা', 'দেশ', 'অনুরাগ', 'প্রেমপত্র', 'ভালোবাসা দিবস', 'প্রেমিকা', 'দেশবাসী', 'প্রেমিক', 'প্রকৃতি', 'প্রেম', 'ভালোবাসা', 'ভালোবাসি', 'প্রেরণা']"
"আমরা মৃত্যুর আগে কী বুঝিতে চাই আর? জানি না কি আহা, সব রাঙা কামনার শিয়রে যে দেয়ালের মতো এসে জাগে ধূসর মৃত্যুর মুখ — একদিন পৃথিবীতে স্বপ্ন ছিল — সোনা ছিল যাহা নিরুত্তর শান্তি পায় — যেন কোন্‌ মায়াবীর প্রয়োজনে লাগে। কী বুঝিতে চাই আর? রৌদ্র নিভে গেলে পাখিপাখলির ডাক শুনি নি কি? প্রান্তরের কুয়াশায় দেখি নি কি উড়ে গেছে কাক",জীবনানন্দ দাশ,"['দেশপ্রেম', 'সন্ধ্যা', 'প্রকৃতিপ্রেম', 'প্রত্যাশা', 'ভাষা', 'দেশ', 'অনুরাগ', 'প্রেমপত্র', 'ভালোবাসা দিবস', 'প্রেমিকা', 'দেশবাসী', 'প্রেমিক', 'প্রকৃতি', 'প্রেম', 'ভালোবাসা', 'ভালোবাসি', 'প্রেরণা']"
"তাঁর চোখ বাঁধা হলো।বুটের প্রথম লাথি রক্তাক্ত করলো তার মুখ।থ্যাতলানো ঠোঁটজোড়া লালা-রক্তে একাকার হলো,জিভ নাড়তেই দুটো ভাঙা দাঁত ঝরে পড়লো কংক্রিটে।মা…..মাগো….. চেঁচিয়ে উঠলো সে।",রুদ্র মুহাম্মদ শহীদুল্লাহ,"['মুক্তিযোদ্ধা', 'স্বাধীনতা', 'মুক্তি', 'মুক্তিযুদ্ধ', 'মুক্তিবাহিনী', 'গণমানুষ', 'যুদ্ধ']"
পাঁচশো পঞ্চান্ন মার্কা আধ-খাওয়া একটা সিগারেটপ্রথমে স্পর্শ করলো তার বুক।পোড়া মাংসের উৎকট গন্ধ ছড়িয়ে পড়লো ঘরের বাতাসে।জ্বলন্ত সিগারেটের স্পর্শতার দেহে টসটসে আঙুরের মতো ফোস্কা তুলতে লাগলো।,রুদ্র মুহাম্মদ শহীদুল্লাহ,"['মুক্তিযোদ্ধা', 'স্বাধীনতা', 'মুক্তি', 'মুক্তিযুদ্ধ', 'মুক্তিবাহিনী', 'মুক্তচিন্তা', 'গণমানুষ', 'যুদ্ধ']"
"তাকে চিৎ করা হলো।পেটের ওপর উঠে এলো দু’জোড়া বুট, কালো ও কর্কশ।কারণ সে তার পাকস্থলির কষ্টের কথা বলেছিলো,বলেছিলো অনাহার ও ক্ষুধার কথা।",রুদ্র মুহাম্মদ শহীদুল্লাহ,"['মুক্তিযোদ্ধা', 'স্বাধীনতা', 'যুদ্ধাপরাধ', 'মুক্তি', 'মুক্তিযুদ্ধ', 'মুক্তিবাহিনী', 'যুদ্ধাপরাধী', 'গণমানুষ', 'মুক্তচিন্তা', 'যুদ্ধ']"
"সে তার দেহের বস্ত্রহীনতার কথা বলেছিলো-বুঝি সে-কারণেফর ফর করে টেনে ছিঁড়ে নেয়া হলো তার শার্ট।প্যান্ট খোলা হলো। সে এখন বিবস্ত্র, বীভৎস।",রুদ্র মুহাম্মদ শহীদুল্লাহ,"['মুক্তিযোদ্ধা', 'স্বাধীনতা', 'যুদ্ধাপরাধ', 'মুক্তি', 'মুক্তিযুদ্ধ', 'মুক্তিবাহিনী', 'যুদ্ধাপরাধী', 'গণমানুষ', 'মুক্তচিন্তা', 'যুদ্ধ']"
"তার দুটো হাত-মুষ্টিবদ্ধ যে-হাত মিছিলে পতাকার মতো উড়েছে সক্রোধে,যে-হাতে সে পোস্টার সেঁটেছে, বিলিয়েছে লিফলেট,লোহার হাতুড়ি দিয়ে সেই হাত ভাঙা হলো।সেই জীবন্ত হাত, জীবন্ত মানুষের হাত।",রুদ্র মুহাম্মদ শহীদুল্লাহ,"['মুক্তিযোদ্ধা', 'স্বাধীনতা', 'যুদ্ধাপরাধ', 'মুক্তি', 'মুক্তিযুদ্ধ', 'মুক্তিবাহিনী', 'যুদ্ধাপরাধী', 'গণমানুষ', 'মুক্তচিন্তা', 'যুদ্ধ']"
"তার দশটি আঙুল-যে-আঙুলে ছুঁয়েছে সে মার মুখ, ভায়ের শরীর,প্রেয়সীর চিবুকের তিল।যে-আঙুলে ছুঁয়েছে সে সাম্যমন্ত্রে দীক্ষিত সাথীর হাত,স্বপ্নবান হাতিয়ার,বাটখারা দিয়ে সে-আঙুল পেষা হলো।সেই জীবন্ত আঙুল, মানুষের জীবন্ত উপমা।লোহার সাঁড়াশি দিয়ে,একটি একটি করে উপড়ে নেয়া হলো তার নির্দোষ নখগুলো।কী চমৎকার লাল রক্তের রঙ।",রুদ্র মুহাম্মদ শহীদুল্লাহ,"['মুক্তিযোদ্ধা', 'স্বাধীনতা', 'অত্যাচার', 'যুদ্ধাপরাধ', 'মুক্তি', 'মুক্তিযুদ্ধ', 'মুক্তিবাহিনী', 'যুদ্ধাপরাধী', 'গণমানুষ', 'মুক্তচিন্তা', 'যুদ্ধ']"
"সে এখন মৃত।তার শরীর ঘিরে থোকা থোকা কৃষ্ণচূড়ার মতোছড়িয়ে রয়েছে রক্ত, তাজা লাল রক্ত।তার থ্যাতলানো একখানা হাতপড়ে আছে এদেশের মানচিত্রের ওপর,আর সে হাত থেকে ঝরে পড়ছে রক্তের দুর্বিনীত লাভা-",রুদ্র মুহাম্মদ শহীদুল্লাহ,"['মুক্তিযোদ্ধা', 'স্বাধীনতা', 'অত্যাচার', 'যুদ্ধাপরাধ', 'মুক্তি', 'মুক্তিযুদ্ধ', 'মুক্তিবাহিনী', 'মানুষ', 'যুদ্ধাপরাধী', 'গণমানুষ', 'মুক্তচিন্তা', 'যুদ্ধ', 'মানবতা']"
"যেদিন আমি হারিয়ে যাব, বুঝবে সেদিন বুঝবেঅস্তপারের সন্ধ্যাতারায় আমার খবর পুঁছবেবুঝবে সেদিন বুঝবে।",কাজী নজরুল ইসলাম,"['একাকিত্ব', 'প্রেমপত্র', 'ভালোবাসা দিবস', 'প্রেমিকা', 'মন', 'উপদেশ', 'প্রেমিক', 'প্রেম', 'ভালোবাসা', 'ভালোবাসি', 'প্রেরণা', 'কষ্ট']"
ছবি আমার বুকে বেধেপাগল হয়ে কেঁদে কেঁদেফিরবে মরু কানন গিরিসাগর আকাশ বাতাশ চিরিসেদিন আমায় খুজবেবুঝবে সেদিন বুঝবে।,কাজী নজরুল ইসলাম,"['একাকিত্ব', 'প্রেমপত্র', 'ভালোবাসা দিবস', 'প্রেমিকা', 'মন', 'প্রেমিক', 'প্রেম', 'ভালোবাসা', 'ভালোবাসি', 'প্রেরণা', 'কষ্ট']"
"স্বপন ভেঙ্গে নিশুত রাতে, জাগবে হঠাৎ চমকেকাহার যেন চেনা ছোয়ায় উঠবে ও-বুক ছমকে-জাগবে হঠাৎ ছমকে,ভাববে বুঝি আমিই এসেবসনু বুকের কোলটি ঘেষেধরতে গিয়ে দেখবে যখনশুন্য শয্যা মিথ্যা স্বপনবেদনাতে চোখ বুজবে-বুঝবে সেদিন বুঝবে",কাজী নজরুল ইসলাম,"['তুমি', 'প্রেমপত্র', 'ভালোবাসা দিবস', 'প্রেমিকা', 'মন', 'উপদেশ', 'প্রেমিক', 'প্রেম', 'ভালোবাসা', 'ভালোবাসি', 'প্রেরণা', 'কষ্ট']"
"গাইতে গিয়ে কন্ঠ ছিড়ে আসবে যখন কান্নাবলবে সবাই- সেই যে পথিক তার শোনানো গান না?-আসবে ভেঙ্গে কান্না,পড়বে মন আমার সোহাগকন্ঠে তোমার কাদবে বেহাগপড়বে মনে আমার ফাকিঅশ্রুহারা কঠিন আখিঘন ঘন মুছবে,বুঝবে সেদিন বুঝবে।",কাজী নজরুল ইসলাম,"['একাকিত্ব', 'প্রেমপত্র', 'ভালোবাসা দিবস', 'প্রেমিকা', 'মন', 'উপদেশ', 'প্রেমিক', 'প্রেম', 'ভালোবাসা', 'ভালোবাসি', 'প্রেরণা', 'কষ্ট']"
"আবার যেদিন শিউলী ফুলে ভরবে তোমার অঙ্গনতুলতে সে ফুল গাথতে মালা, কাপবে তোমারকঙ্কণকাদবে কুটির অঙ্গন,শিউলী ঢাকা মোর সমাধিপড়বে মনে উঠবে কাদিবুকের জ্বালা করবে মালাচোখের জলে সেদিন বালামুখের হাসি ঘুচবেবুঝবে সেদিন বুঝবে।",কাজী নজরুল ইসলাম,"['প্রেমপত্র', 'ভালোবাসা দিবস', 'প্রেমিকা', 'মন', 'উপদেশ', 'প্রেমিক', 'প্রেম', 'ভালোবাসা', 'ভালোবাসি', 'প্রেরণা', 'কষ্ট']"
"আসবে আবার আশিন হাওয়া, শিশির ছেচা রাত্রিথাকবে সবাই- থাকবে না এই মরন পথের যাত্রীইআসবে শিশির রাত্রি,থাকবে পাশে বন্ধু সুজনথাকবে রাত বাহুর বাধনবধুর বুকের পরশনেআমার পরশ আনবে মনেবিষিয়ে ও বুক উঠবেবুঝবে সেদিন বুঝবে।",কাজী নজরুল ইসলাম,"['একাকিত্ব', 'ভাষা', 'প্রেমপত্র', 'ভালোবাসা দিবস', 'প্রেমিকা', 'মন', 'উপদেশ', 'প্রেমিক', 'প্রেম', 'ভালোবাসা', 'ভালোবাসি', 'প্রেরণা']"
"আসবে তোমার শীতের রাতি, আসবে নাকো আর সেতোমার সুখে পড়তো বাধা থাকলে যে জন পার্শ্বেআসবে নাকো আর সে,পড়বে মন মোর বাহুতেমাথা থুয়ে যেদিন শুতেমুখ ফিরিয়ে থাকতে ঘৃণায়সেই স্মৃতি নিত বিছানায়কাটা হয়ে ফুটবে-বুঝবে সেদিন বুঝবে।",কাজী নজরুল ইসলাম,"['প্রেমপত্র', 'ভালোবাসা দিবস', 'প্রেমিকা', 'মন', 'উপদেশ', 'প্রেমিক', 'প্রেম', 'ভালোবাসা', 'ভালোবাসি', 'প্রেরণা']"
"আবার গাঙ্গে আসবে জোয়ার, দুলবে তরী রঙ্গেসেই তরীতে হয়তো কেহ থাকবে তোমার সঙ্গেদুলবে তরী রঙ্গে,পড়বে মনে সে কোন রাতেএক তরীতে ছিলে সাথেএমনি গাঙে ছিল জোয়ারনদীর দুধার এমনি আধারতেমনি তরী ছুটবে-বুঝবে সেদিন বুঝবে।",কাজী নজরুল ইসলাম,"['প্রেমপত্র', 'ভালোবাসা দিবস', 'প্রেমিকা', 'মন', 'উপদেশ', 'প্রেমিক', 'প্রেম', 'ভালোবাসা', 'ভালোবাসি', 'প্রেরণা', 'কষ্ট']"
"তোমার সখার আসবে যেদিন এমনি কারা বন্ধআমার মত কেদে কেদে হয়তো হবে অন্ধসখার কারা বন্ধ,বন্ধু তোমার হানবে হেলাভাঙ্গবে তোমার সুখের খেলাদীর্ঘ লো কাটবে না আরবইতে প্রাণ শ্রান্ত এ ভারসরন মনে যুঝবেবুঝবে সেদিন বুঝবে।",কাজী নজরুল ইসলাম,"['একাকিত্ব', 'প্রেমপত্র', 'ভালোবাসা দিবস', 'প্রেমিকা', 'মন', 'উপদেশ', 'প্রেমিক', 'প্রেম', 'ভালোবাসা', 'ভালোবাসি', 'প্রেরণা']"
"ফুটবে আবার দোলন চাপা, চৈতি রাতের চাদনীআকাশ ছাওয়া তারায় তারায় বাজবে আমার কাদনিচৈতি রাতের চাদনীঋতুর পরে ফিরবে ঋতুসেদিন হে-মোর সোহাগ ভীতুচাইবে কেদে নীল নভোগায়আমার মত চোখ ভরে চায়যে তারা, তায় খুজবেবুঝবে সেদিন বুঝবে।",কাজী নজরুল ইসলাম,"['একাকিত্ব', 'ভাষা', 'প্রেমপত্র', 'ভালোবাসা দিবস', 'প্রেমিকা', 'মন', 'উপদেশ', 'প্রেমিক', 'প্রেম', 'ভালোবাসা', 'ভালোবাসি', 'প্রেরণা']"
"আসবে ঝড়ি, নাচবে তুফান টুটবে সকল বন্ধনকাপবে কুটির সেদিন ত্রাসে, জাগবে বুকেক্রন্দনটুটবে যবে বন্ধন,পড়বে মনে নেই সে সাথেবাধতে বুকে দুঃখ রাতে-আপনি গালে যাচবে চুমাচাইবে আদর মাগবে ছোওয়াআপনি যেচে চুমবেবুঝবে সেদিন বুঝবে।",কাজী নজরুল ইসলাম,"['প্রেমপত্র', 'ভালোবাসা দিবস', 'প্রেমিকা', 'মন', 'উপদেশ', 'প্রেমিক', 'প্রেম', 'ভালোবাসা', 'ভালোবাসি', 'প্রেরণা', 'কষ্ট']"
"আমার বুকের যে কাটা ঘা, তোমায় ব্যাথা হানতসেই আঘাতই যাচবে আবার হয়তো হয়ে শ্রান্তআসব তখন পান্থ,হয়তো তখন আমার কোলেসোহাগ লোভে পড়বে ঢোলেআপনি সেদিন সেধে-কেদেচাপবে বুকে বাহুয় বেধেচরন চুমে পূজবেবুঝবে সেদিন বুঝবে।",কাজী নজরুল ইসলাম,"['একাকিত্ব', 'প্রেমপত্র', 'ভালোবাসা দিবস', 'প্রেমিকা', 'মন', 'উপদেশ', 'প্রেমিক', 'প্রেম', 'ভালোবাসা', 'ভালোবাসি', 'প্রেরণা']"
জাসদ ও বৈজ্ঞানিক সমাজতন্ত্রের ধারক ও বাহকের শতভাগ ভণ্ড,সৈয়দ আশরাফুল ইসলাম,"['সমাজতন্ত্র', 'ভণ্ড', 'জাসদ']"
"হয় তো কেটেছে তার মায়া ও মমতাহীন সজল শৈশবঅথবা গিয়েছে দিনএলোমেলো পরিচর্যাহীন এক রঙিন কৈশোর,নাকি সে আমার মত খুব ভালোবেসেপুড়েছে কপাল তার আকালের এই বাংলাদেশে।বোকা উদ্ভিদ তবে কিমানুষের কাছে প্রেম চেয়েছিলো?চেয়েছিলো আরো কিছু বেশি।",হেলাল হাফিজ,"['বাংলা', 'দেশ', 'দেশপ্রেম', 'প্রত্যাশা', 'প্রকৃতিপ্রেম', 'প্রণয়', 'কৃতজ্ঞ', 'প্রকৃতি', 'বাংলাদেশ', 'সোনার বাংলা', 'রূপসী বাংলা', 'কবিতা', 'মানুষ', 'দেশবাসী', 'আশা', 'প্রেমিক', 'শৈশব', 'আনন্দ', 'প্রেম', 'প্রগতিশীল', 'প্রেরণা']"
"পাগলী আমার ঘুমিয়ে পড়েছেমুঠোফোন তাই শান্ত,আমি রাত জেগে দিচ্ছি পাহারামুঠোফোনের এই প্রান্ত ।এ কথা যদি সে জানতো ?আমিও দিই না জানতে,কবির প্রেম তো এরকমই হয় -পান্তা ফুরায় নুন আনতে ।হে চির-অধরা আমার,তুমি তো সেকথা জানতে ।",নির্মলেন্দু গুণ,"['অনুরাগ', 'তুমি', 'প্রণয়', 'অনুভব', 'অনুভুতি', 'প্রেমপত্র', 'ভালোবাসা দিবস', 'আবেগ', 'প্রেমিকা', 'প্রেমিক', 'অনুভূতি', 'প্রেম', 'ভালোবাসা', 'ভালোবাসি', 'প্রেরণা']"
"আমি নিজে নিয়মিত নামাজ পড়ি, কুরআন থেকে তেলওযাৎ করে দিনের কাজ শুরু করি। আমি জানি, নবী করিম (সঃ) বলেছেন, ধর্ম নিয়ে বাড়াবাড়ি করা যাবে না।",প্রধানমন্ত্রী শেখ হাসিনা,"['কুরআন', 'ধর্ম', 'নামাজ']"
"ছোট ছোট বালুকণা, বিন্দু বিন্দু জল, গড়ে তোলে মহাদেশ, সাগর অতল।",সংগৃহীত,"['অনুপ্রেরণা', 'উপদেশ']"
