quote,writer,tags
"মনে যখন একটা প্রবল আনন্দ একটা বৃহৎ প্রেমের সঞ্চার হয় তখন মানুষ মনে করে, ‘আমি সব পারি’। তখন হঠাৎ আত্মবিসর্জনের ইচ্ছা বলবতী হইয়া ওঠে।",রবীন্দ্রনাথ ঠাকুর,"['দর্শন', 'জীবন']"
"সংসারের কোন কাজেই যে হতভাগ্যের বুদ্ধি খেলে না, সে নিশ্চয়ই ভাল বই লিখিবে",রবীন্দ্রনাথ ঠাকুর,['সাহিত্য']
"যে ছেলে চাবামাত্রই পায়, চাবার পূর্বেই যার অভাব মোচন হতে থাকে; সে নিতান্ত দুর্ভাগা। ইচ্ছা দমন করতে না শিখে কেউ কোনকালে সুখী হতে পারেনা।",রবীন্দ্রনাথ ঠাকুর,"['দর্শন', 'জীবন']"
সামনে একটা পাথর পড়লে যে লোক ঘুরে না গিয়ে সেটা ডিঙ্গিয়ে পথ সংক্ষেপ করতে চায় - বিলম্ব তারই অদৃষ্টে আছে,রবীন্দ্রনাথ ঠাকুর,['দর্শন']
"বিয়ে করলে মানুষকে মেনে নিতে হয়, তখন আর গড়ে নেবার ফাঁক পাওয়া যায় না",রবীন্দ্রনাথ ঠাকুর,"['বিয়ে', 'জীবন']"
"লোকে ভুলে যায় দাম্পত্যটা একটা আর্ট, প্রতিদিন ওকে নতুন করে সৃষ্টি করা চাই",রবীন্দ্রনাথ ঠাকুর,['দাম্পত্য']
সোহাগের সঙ্গে রাগ না মিশিলে ভালবাসার স্বাদ থাকেনা - তরকারীতে লঙ্কামরিচের মত,রবীন্দ্রনাথ ঠাকুর,"['প্রেম', 'তুমি', 'প্রণয়', 'অনুভব', 'অনুভুতি', 'প্রেমপত্র', 'ভালোবাসা দিবস', 'প্রেমিকা', 'অনুভূতি', 'উপদেশ', 'প্রেমিক', 'মায়া', 'ভালোবাসা', 'ভালোবাসি', 'প্রেরণা']"
"সাধারণত স্ত্রীজাতি কাঁচা আম, ঝাল লঙ্কা এবং কড়া স্বামীই ভালোবাসে। যে দুর্ভাগ্য পুরুষ নিজের স্ত্রীর ভালোবাসা হইতে বঞ্চিত সে - যে কুশ্রী অথবা নির্ধন তাহা নহে; সে নিতান্ত নিরীহ।",রবীন্দ্রনাথ ঠাকুর,"['নারী', 'পুরুষ']"
চিঠি লেখার প্রতিভা সবচেয়ে বিকশিত হয় প্রেমে পড়লে। প্রেমপত্র তাই সবদেশে এত আদরের।,শংকর,"['প্রেম', 'চিঠি', 'প্রেমপত্র']"
মেয়েদের চরিত্রের মাধুর্য পাওয়া যায় কুমারী অবস্থায়,প্রবোধকুমার সাণ্যাল,"['নারী', 'কুমারী']"
আমার অভাব যদি তুমি বুঝতে না পার তবে তোমার সাথে আমার বন্ধন কখনো দৃঢ় হবে না,কালস্যান্ডবার্গ,"['প্রেম', 'ভালোবাসা']"
ভালোবাসার চোখকে ফাকি দেওয়া যায় না,জন ক্রাউন,"['প্রেম', 'ভালোবাসা']"
ধোয়া টাকা আর প্রেম কিছুতেই চেপে রাখা যায় না। ঠিক ফুটে বেরুবেই।,শংকর,"['প্রেম', 'ভালোবাসা']"
প্রেম একটি লাল গোলাপ,শীর্ষেন্দু মুখোপাধ্যায়,"['গোলাপ', 'প্রেম', 'ভালোবাসা']"
ভালোবাসা দীন ভিখারিকেও রাজা করে,নিমাই ভট্টাচার্য,"['প্রেম', 'ভালোবাসা']"
"কোন কিছু পাওয়ার আনন্দ, হারানোর বেদনার চেয়ে অনেক গুণ ছোট",সুজন মজুমদার,"['বেদনা', 'আনন্দ']"
"বৃষ্টি পড়ে টাপুর টুপুর,নদেয় এল বান",রবীন্দ্রনাথ ঠাকুর,['বৃষ্টি']
"তুমি যদি না দেখা দাও, কর আমায় হেলা,কেমন করে কাটে আমার এমন বাদল-বেলা।",রবীন্দ্রনাথ ঠাকুর,"['বর্ষা', 'প্রেম', 'বৃষ্টি']"
"জীবনে প্রগতির অাশা নিজেকে ভয়, সন্দেহ থেকে দূরে রাখে এবং তার সমাধানের প্রয়াস চালাতে থাকে।",নেতাজি সুভাষচন্দ্র বসু,"['অনুপ্রেরণা', 'জীবন']"
স্বার্থসিদ্ধির চরমতম অভিব্যক্তি প্রেম,ব্রুক জ্যাকসন,"['স্বার্থ', 'প্রেম', 'ভালোবাসা']"
লুকোচুরিই তো প্রেমের রোমান্স। প্রেম যেদিন স্বীকৃতি পেয়ে যায় সেদিন থেকেই প্রেমের মজাও নষ্ট হয়ে যায়।,আশুতোষ মুখোপাধ্যায়,"['লুকোচুরি', 'প্রেম', 'ভালোবাসা']"
যে পুরুষ অসংশয়ে অকুন্ঠিতভাবে নিজেকে প্রচার করিতে পারে সেই সমর্থ পুরুষ সহজেই নারীর দৃষ্টি আর্কষণ করিতে পারে।,রবীন্দ্রনাথ ঠাকুর,"['নারী', 'পুরুষ']"
ভালো লাগা ভালোবাসা নয়,প্রবোধকুমার সাণ্যাল,['ভালোবাসা']
যায় যদি লুপ্ত হয়ে থাকে শুধু থাক এক বিন্দু নয়নের জল কালের কপোল তলে শুভ্র সমুজ্জ্বল এ তাজমহল,রবীন্দ্রনাথ ঠাকুর,"['প্রেম', 'ভালোবাসা']"
পরিণয় দুটি হৃদয়কে মিলিয়ে দেয় কিন্তু এই মিলন আবিস্কার করবার জন্যই চলে সারাজীবন তীব্র সংগ্রাম,সংগৃহীত,"['প্রণয়', 'পরিণয়']"
ট্রাফিক জ্যামেরও একটা ভাল দিক আছে। এই সময়ে রাস্তা পারাপার করতে পারা যায়,হুমায়ূন আহমেদ,['ট্রাফিক জ্যাম']
মেয়েরা অতি দূরের আত্মীয়কে কাছের মানুষ প্রমাণ করার জন্যে চট করে তুই বলে,হুমায়ূন আহমেদ,['নারী']
আলো যেমন চারপাশ আলো করে তোলে একজন পবিত্র মানুষও তার চারপাশ আলো করে তুলবেই,হুমায়ূন আহমেদ,"['মানুষ', 'পবিত্র']"
ধুমপানও অভ্যাসের ব্যাপার। অভ্যাস না থাকলে সিগারেটের ধোঁয়ায় দম বন্ধ হয়ে আসবে। আবার যারা অভ্যস্ত তারা পাগল হয়ে থাকে এই ধোঁয়াটার জন্য।,হুমায়ূন আহমেদ,"['ধুমপান', 'অভ্যাস']"
মেয়েরা এমনিতেই সন্দেহ বাতিকগ্রস্ত হয়। পেটে সন্তান থাকা অবস্থায় সন্দেহ রোগ অনেকগুনে বেড়ে যায়।,হুমায়ূন আহমেদ,"['নারী', 'সন্দেহ', 'সন্তান']"
বিলাই আর পুরুষ মানুষ এই দুই জাতের কোন বিশ্বাস নাই। দুইটাই ছোকছুকানি জাত।,হুমায়ূন আহমেদ,"['পুরুষ', 'অভ্যাস']"
সময় নেতা তৈরি করে। ঠিক সময়ে ঠিক নেতা এই কারণেই বের হয়ে আসে,হুমায়ূন আহমেদ,"['নেতা', 'সময়']"
সব গ্রেটম্যানরাই কোনো না কোনো সময়ে বাড়ি থেকে পালিয়েছেন। একমাত্র ব্যতিক্রম রবি ঠাকুর।,হুমায়ূন আহমেদ,"['মহামানব', 'রবীন্দ্রনাথ']"
সুন্দরী মেয়েদের হাতের লেখা সুন্দর হয়। এটা হল নিপাতনে সিদ্ধ। সুন্দরীরা মনে প্রাণে জানে তারা সুন্দর। তাদের চেষ্টাই থাকে তাদের ঘিরে যা থাকবে সবই সুন্দর হবে।,হুমায়ূন আহমেদ,"['নারী', 'সৌন্দর্য']"
দু'টি দেহে একটি আত্মার অবস্থানই হলো বন্ধুত্ব,এরিস্টটল,['বন্ধুত্ব']
প্রকৃতির সর্বশ্রেষ্ঠ সৃষ্টির নাম বন্ধুত্ব,এমারসন,['বন্ধুত্ব']
"বিশ্বস্ত বন্ধু হচ্ছে প্রাণরক্ষাকারী ছায়ার মতো। যে তা খুঁজে পেলো, সে একটি গুপ্তধন পেলো।",নিটসে,"['বন্ধুত্ব', 'বন্ধু']"
আমাদের সমস্যা হচ্ছে আমাদের যখন গুছিয়ে কথা বলা দরকার তখন টেলিগ্রাফের ভাষায় কথা বলি। আর যখন সার সংক্ষেপ বলা দরকার তখন পাঁচ শ পৃষ্ঠার উপন্যাস শুরু করি।,হুমায়ূন আহমেদ,['বাঙালি']
"অল্প বয়সের ভালোবাসা অন্ধ গন্ডারের মত। শুধুই একদিকে যায়। যুক্তি দিয়ে, বুদ্ধি দিয়ে, আদর দিয়ে এই গন্ডারকে সামলানো যায় না।",হুমায়ূন আহমেদ,"['প্রেম', 'ভালোবাসা', 'বয়স']"
রূপবতীদের সব অভদ্রতা ক্ষমা করা যায়। এরা অভদ্র হবে এটাই স্বাভাবিক। এরা ভদ্র হলে অস্বস্তি লাগে।,হুমায়ূন আহমেদ,"['নারী', 'রূপবতী']"
প্রকৃতি মাঝে মাঝে মানুষকে এমন বিপদে ফেলে। চোখে পানি আসার সিস্টেম না থাকলে জীবন যাপন হয়তো সহজ হতো।,হুমায়ূন আহমেদ,"['প্রকৃতি', 'জীবন']"
মানুষ মিথ্যা কথা বলে প্রয়োজনে এবং স্বার্থের কারনে,হুমায়ূন আহমেদ,"['স্বার্থ', 'মিথ্যা']"
"মানুষের সঙ্গে গাছের অনেক মিল আছে। সবচেয়ে বড় মিল হলো, গাছের মত মানুষেরও শিকড় আছে। শিকড় উপড়ে ফেললে গাছের মৃত্যু হয়, মানুষেরও এক ধরনের মৃত্যু হয়। মানুষের নিয়তি হচ্ছে তাকে অনেক ক্ষুদ্র ক্ষুদ্র মৃত্যুর ভেতর দিয়ে অগ্রসর হতে হয় চুড়ান্ত মৃত্যুর দিকে।",হুমায়ূন আহমেদ,"['দর্শন', 'জীবন']"
মানুষের মনের ভাব কখনোই মুখে প্রতিফলিত হয় না। মুখের ওপর সর্বদা পর্দা থাকে। শুধু মানুষ যখন হাসে তখন পর্দা দূরীভূত হয়। হাস্যরত একজন মানুষের মুখে তার মনের ছায়া দেখা যায়।,হুমায়ূন আহমেদ,"['মন', 'জীবন']"
রুচির রহস্য ক্ষুধায়। যেখানে ক্ষুধা নেই সেখানে রুচিও নেই।,হুমায়ূন আহমেদ,"['রুচি', 'ক্ষুধা']"
"সত্য কথাগুলো সব সময় বক্তৃতার মতো শোনায়, মিথ্যাগুলো শোনায় কবিতার মত",হুমায়ূন আহমেদ,"['সত্য', 'মিথ্যা']"
"দরিদ্র পুরুষদের প্রতি মেয়েদের একপ্রকার মায়া জন্মে যায়, আর এই মায়া থেকে জন্মায় ভালোবাসা",হুমায়ূন আহমেদ,"['নারী', 'মায়া', 'ভালোবাসা']"
যে মানুষ নিঃশব্দে হাসে তাহার বিষয়ে খুব সাবধান। দুই ধরনের মানুষ নিঃশব্দে হাসে- অতি উঁচু স্তরের সাধক এবং অতি নিম্নশ্রেণীর পিশাচ চরিত্রের মানুষ,হুমায়ূন আহমেদ,"['দর্শন', 'হাসি', 'জীবন']"
"মানুষকে ঘৃণা করার অপরাধে কাউকে কখনও মৃত্যুদণ্ড দেওয়া হয়নি, অথচ মানুষকে ভালোবাসার অপরাধে অতীতে অনেককেই হত্যা করা হয়েছে, ভবিষ্যতেও হয়ত হবে",হুমায়ূন আহমেদ,"['মানুষ', 'ভালোবাসা', 'ঘৃনা']"
অতি ভয়ঙ্কর যে গরল তাহাতেও অমৃত মিশ্রিত থাকে। অতি পবিত্র অমৃতে থাকে প্রাণসংহারক গরল। খাদ ছাড়া সোনা হয় না। গরল ছাড়া অমৃতও হয় না।,হুমায়ূন আহমেদ,"['দর্শন', 'জীবন']"
"কৌতুহল আমাদের সবারই আছে, কিন্ত কৌতুহল মেটানোর জন্যে প্রয়োজনীয় পরিশ্রমটি আমরা করি না। করতে চাই না।",হুমায়ূন আহমেদ,"['পরিশ্রম', 'কৌতুহল']"
কিছু মানুষ ধরেই নিয়েছে তারা যা ভাবছে তাই ঠিক। তাদের জগতটাই একমাত্র সত্যি জগত। এরা রহস্য খুঁজবে না। এরা স্বপ্ন দেখবে না।,হুমায়ূন আহমেদ,"['স্বপ্ন', 'জীবন']"
"পৃথিবীতে আনন্দ এবং দুঃখ সব সময় থাকবে সমান সমান। বিজ্ঞানের ভাষায় আনন্দের সংরক্ষণশীলতা। একজন কেউ চরম আনন্দ পেলে, অন্য জনকে চরম দুঃখ পেতে হবে।",হুমায়ূন আহমেদ,"['সুখ', 'দুঃখ', 'আনন্দ']"
বাঙ্গালীকে বেশি প্রশংসা করতে নেই। প্রশংসা করলেই বাঙালি এক লাফে আকাশে উঠে যায়। আকাশে উঠে গেলেও ক্ষতি ছিল না- আকাশ থেকে থুথু ফেলা শুরু করে।,হুমায়ূন আহমেদ,"['প্রশংসা', 'বাঙালি']"
"গল্প উপন্যাসের নায়ক-নায়িকাদের সুখ-দুঃখে যারা কাতর, তারা সাধারণত নিজেদের সুখ দুঃখের ব্যাপারে উদাসীন হয়।",হুমায়ূন আহমেদ,"['উদাসীনতা', 'দুঃখ', 'সুখ']"
রিকশায় চড়ায় একটা রাজকীয় ব্যাপার আছে। মাথা সামান্য উচু করলেই আকাশ দেখতে দেখতে যাওয়া যায়।,হুমায়ূন আহমেদ,['রিকশা']
সূর্যোদয় দেখাটা অত্যন্ত জরুরী। এই দৃশ্যটি মানুষকে ভাবতে শিখায়। মন বড় করে।,হুমায়ূন আহমেদ,"['সূর্যোদয়', 'মন']"
আদর্শ মানুষকে কেউ পছন্দ করে না। আদর্শ মানুষ ডিসটিল্ড ওয়াটারের মতো - স্বাদহীন। সমাজ পছন্দ করে অনাদর্শ মানুষকে। যারা ডিসটিল্ড ওয়াটার নয় - কোকাকোলা ও পেপসির মতো মিষ্টি কিন্তু ঝাঁঝালো।,হুমায়ূন আহমেদ,"['আদর্শ', 'সমাজ']"
যখন তোমার পকেট ভর্তি টাকা থাকবে তখন শুধুমাত্র তুমি ভুলে যাবে যে 'তুমি কে'; কিন্তু যখন তোমার পকেট ফাঁকা থাকবে তখন সমগ্র দুনিয়া ভুলে যাবে 'তুমি কে'!,বিল গেটস,"['অর্থ', 'দুনিয়া']"
"আপনি যদি গরীব হয়ে জন্ম নেন তাহলে এটা আপনার দোষ নয়, কিন্তু যদি গরীব থেকেই মারা যান তবে সেটা আপনার দোষ।",বিল গেটস,['অনুপ্রেরণা']
একবার পরীক্ষায় কয়েকটা বিষয়ে আমি ফেল করেছিলাম কিন্তু আমার বন্ধু সব বিষয়েই পাশ করে। এখন সে মাইক্রোসফটের একজন ইঞ্জিনিয়ার আর আমি মাইক্রোসফটের প্রতিষ্ঠাতা।,বিল গেটস,['অনুপ্রেরণা']
"ভাল চিন্তা করুন, কারন আমাদের চিন্তা এক সময় প্রতিজ্ঞায় পরিণত হয়",মহাত্মা গান্ধী,"['চিন্তা', 'দর্শন', 'প্রতিজ্ঞা']"
"দৃঢ় প্রতিজ্ঞা করুন, কারন আমাদের প্রতিজ্ঞা এক সময় আচরনে পরিণত হয়",মহাত্মা গান্ধী,"['আচরন', 'প্রতিজ্ঞা']"
"ভাল আচরন করুন, কারন আমাদের আচরন এক সময় অভ্যাসে পরিণত হয়",মহাত্মা গান্ধী,"['আচরন', 'অভ্যাস']"
"ভাল অভ্যাস করুন, কারন আমাদের অভ্যাস এক সময় মর্যাদায় পরিণত হয়",মহাত্মা গান্ধী,"['মর্যাদা', 'অভ্যাস']"
"মর্যাদা ধরে রাখুন, কারন এই মর্যাদা এক সময় আমাদের লক্ষ্যে পৌঁছে দেয়",মহাত্মা গান্ধী,"['লক্ষ্য', 'মর্যাদা']"
পরিণয় দুটি হৃদয়কে মিলিয়ে দেয় কিন্তু এই মিলন আবিস্কার করবার জন্যই চলে সারাজীবন তীব্র সংগ্রাম,সংগৃহীত,"['পরিণয়', 'জীবন']"
বধু তোমার গরবে গরবিনী নাম রুপসী তোমার রুপে হেন মনে হয় ও দুটি চরণ সদা নিয়ে রাখি বুকে,জ্ঞানদাস,"['নারী', 'প্রেম', 'ভালোবাসা', 'বধু']"
"যখন রাত আসে তখন ঘুম আসে যখন ঘুম আসে তখন স্বপ্ন আসে যখন স্বপ্ন আসে তখন তুমি আসো – যখন তুমি আসো তখন ঘুমও আসে না, স্বপ্নও আসে না।",নিমাই ভট্টাচার্য,['নারী']
ছোট ছোট বিচ্ছেদ প্রেমকে গভীর করে আর দীর্ঘ বিচ্ছেদ প্রেমকে হত্যা করে,মিরবো,"['প্রেম', 'ভালোবাসা', 'বিচ্ছেদ']"
আমাদের চাষীরা হল সবচেয়ে দু:খী ও নির্যাতিত এবং তাদের অবস্হার উন্নতির জন্যে আমাদের উদ্যোগের বিরাট অংশ অবশ্যই তাদের পেছনে নিয়োজিত করতে হবে,বঙ্গবন্ধু শেখ মুজিবুর রহমান,"['কৃষক', 'চাষী', 'বাংলাদেশ']"
আর সাম্প্রদায়িকতা যেন মাথাচারা দিয়ে উঠতে না পারে। ধর্ম নিরপেক্ষ রাষ্ট্র বাংলাদেশ। মুসলমান তার ধর্মকর্ম করবে।হিন্দু তার ধর্মকর্ম করবে। বৌদ্ধ তার ধর্মকর্ম করবে। কেউ কাউকে বাধা দিতে পারবে না। কিন্তু ইসলামের নামে আর বাংলাদেশের মানুষকে লুট করে খেতে দেওয়া হবে না।,বঙ্গবন্ধু শেখ মুজিবুর রহমান,"['বাংলাদেশ', 'সাম্প্রদায়িকতা', 'ধর্ম']"
"আমার দেশ স্বাধীন দেশ। ভারত হোক, আমেরিকা হোক, রাশিয়া হোক, গ্রেট ব্রিটেন হোক কারো এমন শক্তি নাই যে, আমি যতক্ষণ বেঁচে আছি ততক্ষণ আমার দেশের অভ্যন্তরীণ ব্যাপারে হস্তক্ষেপ করতে পারে।",বঙ্গবন্ধু শেখ মুজিবুর রহমান,"['সার্বভৌমত্ব', 'বাংলাদেশ']"
